{
  "@context": [
    "https://www.w3.org/2018/credentials/v1",
    "https://trust.propdata.org.uk/contexts/pdtf-v2.jsonld"
  ],
  "id": "https://trust.propdata.org.uk/credentials/property/uprn-123456789",
  "type": ["VerifiableCredential", "PropertyCredential"],
  "issuer": "did:web:landregistry.example",
  "validFrom": "2025-01-15T09:00:00Z",
  "validUntil": "2026-01-15T09:00:00Z",
  "credentialSubject": {
    "id": "urn:pdtf:uprn:123456789",
    "uprn": "123456789",
    "propertyAddress": {
      "streetAddress": "456 Oak Avenue",
      "addressLocality": "Manchester",
      "addressRegion": "Greater Manchester", 
      "postalCode": "M1 2AB",
      "addressCountry": "GB"
    },
    "propertyType": "semi-detached",
    "tenure": "freehold",
    "councilTaxBand": "D",
    "epcRating": "C",
    "floorArea": {
      "value": 125.5,
      "unit": "sqm"
    },
    "numberOfBedrooms": 3,
    "numberOfBathrooms": 2,
    "parkingSpaces": 1,
    "garden": true,
    "yearBuilt": 1985
  },
  "credentialStatus": {
    "id": "https://landregistry.example/status/properties/sl2021.json#456",
    "type": "StatusList2021Entry",
    "statusPurpose": "revocation",
    "statusListIndex": "456",
    "statusListCredential": "https://landregistry.example/status/properties/sl2021.json"
  },
  "credentialSchema": {
    "id": "https://trust.propdata.org.uk/schemas/PDTF-VerifiableCredential",
    "type": "JsonSchema"
  },
  "termsOfUse": [{
    "type": "TrustFrameworkPolicy",
    "trustFramework": "PropertyDataTrustFramework",
    "confidentialityLevel": "Public",
    "pii": false
  }],
  "evidence": [{
    "type": "Hyperlink",
    "href": "https://landregistry.example/property/123456789",
    "hash": "sha256-d6b8ca0d..."
  }],
  "proof": {
    "type": "DataIntegrityProof",
    "proofPurpose": "assertionMethod",
    "verificationMethod": "did:web:landregistry.example#key-1",
    "created": "2025-01-15T09:05:00Z",
    "jws": "eyJhbGciOiJFZERTQSIsImI2NCI6ZmFsc2UsImNyaXQiOlsiYjY0Il19..example_signature"
  }
}