{
  "@context": [
    "https://www.w3.org/2018/credentials/v1",
    "https://trust.propdata.org.uk/contexts/pdtf-v2.jsonld"
  ],
  "id": "https://trust.propdata.org.uk/credentials/person/12345",
  "type": ["VerifiableCredential", "PersonCredential"],
  "issuer": "did:web:conveyancer.example",
  "validFrom": "2025-01-15T10:30:00Z",
  "credentialSubject": {
    "id": "did:key:z6MkpTHR8VNsBxYAAWHut2Geadd9jSwuBV8xRoAnwWsdvktH",
    "name": "John Smith",
    "givenName": "John",
    "familyName": "Smith",
    "dateOfBirth": "1985-03-15",
    "email": "john.smith@example.com",
    "telephone": "+44 20 7946 0958",
    "address": {
      "streetAddress": "123 High Street",
      "addressLocality": "London",
      "addressRegion": "Greater London",
      "postalCode": "SW1A 1AA",
      "addressCountry": "GB"
    },
    "capacity": "owner"
  },
  "credentialStatus": {
    "id": "https://conveyancer.example/status/persons/sl2021.json#1024",
    "type": "StatusList2021Entry",
    "statusPurpose": "revocation",
    "statusListIndex": "1024",
    "statusListCredential": "https://conveyancer.example/status/persons/sl2021.json"
  },
  "credentialSchema": {
    "id": "https://trust.propdata.org.uk/schemas/PDTF-VerifiableCredential",
    "type": "JsonSchema"
  },
  "termsOfUse": [{
    "type": "TrustFrameworkPolicy",
    "trustFramework": "PropertyDataTrustFramework",
    "confidentialityLevel": "Confidential",
    "requiredCredentials": ["conveyancer", "buyer", "seller"],
    "pii": true
  }],
  "evidence": [{
    "type": "Hyperlink",
    "href": "https://conveyancer.example/evidence/person-verification/12345",
    "hash": "sha256-d6b8ca0d4f2a9e1c8b7a6d5e3f4c2a9b8e7d6c5a4f3b2e1d0c9a8b7c6d5e4f3a2b1",
    "mediaType": "application/pdf"
  }],
  "proof": {
    "type": "DataIntegrityProof",
    "proofPurpose": "assertionMethod",
    "verificationMethod": "did:web:conveyancer.example#key-1",
    "created": "2025-01-15T10:35:00Z",
    "jws": "eyJhbGciOiJFZERTQSIsImI2NCI6ZmFsc2UsImNyaXQiOlsiYjY0Il19..example_signature"
  }
}